{
  "schemaVersion": "research_collection_plan_v1",
  "planId": "tnm-manual-20260903161000-collection-plan",
  "runId": "tnm-manual-20260903161000",
  "createdAt": "2026-09-03T16:10:00.952Z",
  "status": "complete",
  "intelligenceRequirement": "Resolve the specific capabilities or public needs, Canadian relevance, technical and operational detail, proof and current activity, Mission Area or Public Need connection, material unknowns, and next reviewer action needed to address organization-editorial-profile:null: This production corpus segment selects 18 of 18 currently eligible published organizations for comprehensive, review-first editorial-profile refresh without automatic activation or publication.",
  "targetSubjects": [
    {
      "subjectId": "organization-blue-ocean-gear",
      "subjectType": "organization",
      "name": "Blue Ocean Gear",
      "aliases": [],
      "canonicalIdentifiers": [
        "blue-ocean-gear",
        "43fa24da-7d7c-477d-b75f-5d03f6368844",
        "blueoceangear.com"
      ]
    },
    {
      "subjectId": "organization-c-tow-marine",
      "subjectType": "organization",
      "name": "C-Tow Marine",
      "aliases": [],
      "canonicalIdentifiers": [
        "c-tow-marine",
        "aded9006-d086-4960-bfc6-88ff7c5cc89e",
        "c-tow.ca"
      ]
    },
    {
      "subjectId": "organization-clear-seas-research",
      "subjectType": "organization",
      "name": "Clear Seas Research",
      "aliases": [],
      "canonicalIdentifiers": [
        "clear-seas-research",
        "fb5081eb-df99-4568-9311-ff83854c9c8e",
        "clearseas.org"
      ]
    },
    {
      "subjectId": "organization-coastal-defence-systems",
      "subjectType": "organization",
      "name": "Coastal Defence Systems",
      "aliases": [],
      "canonicalIdentifiers": [
        "coastal-defence-systems",
        "f94e6a24-70ec-492e-a9e2-751c34bd4e8b",
        "coastaldefencesystems.ca"
      ]
    },
    {
      "subjectId": "organization-drone-delivery-canada",
      "subjectType": "organization",
      "name": "Drone Delivery Canada",
      "aliases": [],
      "canonicalIdentifiers": [
        "drone-delivery-canada",
        "d011a992-6478-4b30-85a7-f1ebd8f60300",
        "dronedeliverycanada.com"
      ]
    },
    {
      "subjectId": "organization-elbit-systems-canada",
      "subjectType": "organization",
      "name": "Elbit Systems Canada",
      "aliases": [],
      "canonicalIdentifiers": [
        "elbit-systems-canada",
        "b7862e8c-6b2f-420e-8048-c25f469c8eee",
        "elbitsystems.com"
      ]
    },
    {
      "subjectId": "organization-ferreol-technologies",
      "subjectType": "organization",
      "name": "Ferreol Technologies",
      "aliases": [],
      "canonicalIdentifiers": [
        "ferreol-technologies",
        "a36edf2f-2585-49db-b0ad-d354046f9028",
        "scaliumplus.com"
      ]
    },
    {
      "subjectId": "organization-foresight-autonomous-holdings-canada",
      "subjectType": "organization",
      "name": "Foresight Autonomous Holdings Canada",
      "aliases": [],
      "canonicalIdentifiers": [
        "foresight-autonomous-holdings-canada",
        "4d4fcf08-b824-4a94-aef7-fd4f298b3424",
        "foresightauto.com"
      ]
    },
    {
      "subjectId": "organization-industrial-recon",
      "subjectType": "organization",
      "name": "Industrial Recon",
      "aliases": [],
      "canonicalIdentifiers": [
        "industrial-recon",
        "5b108d21-8198-4aa3-92c5-d5e48c51a22e",
        "industrialrecon.com"
      ]
    },
    {
      "subjectId": "organization-leddartech",
      "subjectType": "organization",
      "name": "LeddarTech",
      "aliases": [],
      "canonicalIdentifiers": [
        "leddartech",
        "f83e3853-20fe-4bc2-bd13-2166eb75f3e0",
        "leddartech.com"
      ]
    },
    {
      "subjectId": "organization-mecanica-scientific-services",
      "subjectType": "organization",
      "name": "Mecanica Scientific Services",
      "aliases": [],
      "canonicalIdentifiers": [
        "mecanica-scientific-services",
        "45baea17-17fc-4aa3-bc7e-987b7aba2038",
        "mecanicass.com"
      ]
    },
    {
      "subjectId": "organization-picomole",
      "subjectType": "organization",
      "name": "Picomole",
      "aliases": [],
      "canonicalIdentifiers": [
        "picomole",
        "984d952c-5d0f-464a-9ab3-3ab1f853cceb",
        "picomole.com"
      ]
    },
    {
      "subjectId": "organization-quanergy-solutions-canada",
      "subjectType": "organization",
      "name": "Quanergy Solutions Canada",
      "aliases": [],
      "canonicalIdentifiers": [
        "quanergy-solutions-canada",
        "4d594905-5098-4443-a6b7-f147ca50cb4e",
        "quanergy.com"
      ]
    },
    {
      "subjectId": "organization-sierra-space-canada",
      "subjectType": "organization",
      "name": "Sierra Space Canada",
      "aliases": [],
      "canonicalIdentifiers": [
        "sierra-space-canada",
        "75f13a51-1e32-4912-a5f3-6c27655dc06e",
        "sierraspace.com"
      ]
    },
    {
      "subjectId": "organization-skyx",
      "subjectType": "organization",
      "name": "SkyX",
      "aliases": [],
      "canonicalIdentifiers": [
        "skyx",
        "bf206829-f4dd-4014-9534-1f2150d4cb53",
        "skyx.com"
      ]
    },
    {
      "subjectId": "organization-spaceryde",
      "subjectType": "organization",
      "name": "SpaceRyde",
      "aliases": [],
      "canonicalIdentifiers": [
        "spaceryde",
        "15c28ce5-2279-4c6e-adc4-56780fee2bc1",
        "spaceryde.com"
      ]
    },
    {
      "subjectId": "organization-tangent-animation",
      "subjectType": "organization",
      "name": "Tangent Animation",
      "aliases": [],
      "canonicalIdentifiers": [
        "tangent-animation",
        "b56d7292-6024-4bc0-b495-569c3d93590d",
        "tangentspace.ca"
      ]
    },
    {
      "subjectId": "organization-viking-air",
      "subjectType": "organization",
      "name": "Viking Air",
      "aliases": [],
      "canonicalIdentifiers": [
        "viking-air",
        "9d6fcede-ff5a-4c86-8f40-b7604d84f6c9",
        "vikingair.com"
      ]
    }
  ],
  "priorityQuestions": [
    {
      "questionId": "identity-canadian-presence",
      "subjectType": "organization",
      "question": "What is the canonical organization identity, ownership context, aliases, and evidence of an active Canadian operating presence?",
      "targetFieldPaths": [
        "organization.name",
        "organization.aliases",
        "organization.primaryLocation",
        "organization.publicContact",
        "organization.canadianFootprint"
      ],
      "evidenceThreshold": "one_anchor"
    },
    {
      "questionId": "capability-definition",
      "subjectType": "technology",
      "question": "Which independently reviewable products, facilities, test services, variants, subsystems, or operating functions exist, and what specifications, interfaces, maturity, dependencies, access constraints, applications, and differentiators are publicly supportable?",
      "targetFieldPaths": [
        "capabilities.*.summary",
        "capabilities.*.features",
        "capabilities.*.applications",
        "capabilities.*.maturity",
        "capabilities.*.commercialAvailability",
        "organization.operatingContext"
      ],
      "evidenceThreshold": "anchor_plus_independent_corroboration"
    },
    {
      "questionId": "proof-and-current-state",
      "subjectType": "signal",
      "question": "Which trials, evaluations, deployments, contracts, procurement lifecycle events, public programs, customer activity, partnerships, and dated developments materially change the current record, and which consequential performance or outcome claims need an independent source before they are stated as proof?",
      "targetFieldPaths": [
        "organization.currentActivity",
        "organization.currentActivityAsOf",
        "programParticipations.*.participation.publicSummary",
        "programParticipations.*.participation.lifecycleStage",
        "fundingEvents.*.disclosedSummary",
        "relationships.*.publicSummary",
        "demandSource.summary",
        "requirements.*.problemStatement"
      ],
      "evidenceThreshold": "one_anchor"
    },
    {
      "questionId": "mission-public-need-read",
      "subjectType": "demand",
      "question": "Which current Mission Area or exact published Public Need could this capability inform, what source-backed premises support each side, and what constraint prevents the relationship from being treated as proven fit?",
      "targetFieldPaths": [
        "capabilities.*.missionMatches",
        "requirements.*.problemStatement",
        "requirements.*.desiredEndState",
        "reviewerRationale"
      ],
      "evidenceThreshold": "anchor_plus_independent_corroboration"
    },
    {
      "questionId": "editorial-profile-readiness",
      "subjectType": "organization",
      "question": "Does the evidence support an executive description, current activity, operating context, Canadian footprint, and at most four specific first-conversation questions without converting missing fields into public unknowns?",
      "targetFieldPaths": [
        "organization.description",
        "organization.currentActivity",
        "organization.operatingContext",
        "organization.canadianFootprint",
        "organization.reviewedQuestions"
      ],
      "evidenceThreshold": "one_anchor"
    },
    {
      "questionId": "unknowns-and-tradeoffs",
      "subjectType": "signal",
      "question": "Which material facts are not found, not publicly stated, conflicted, stale, superseded, constrained, or not applicable, and how does each gap affect the reviewer decision?",
      "targetFieldPaths": [
        "reviewWarnings",
        "reviewerRationale"
      ],
      "evidenceThreshold": "one_anchor"
    },
    {
      "questionId": "reviewer-action",
      "subjectType": "signal",